<namespace xmlns:xsi="http://www.w3.org/2001/XMLSchema-instance" xsi:noNamespaceSchemaLocation="namespace-1.5.0.xsd" version="1.5.0">
  <filesystems>
    <filesystem name="TESTVO-FS" fs_type="ext3">
      <space-token-description>TESTVO_TOKEN</space-token-description>
      <storage-class>T0D1</storage-class>
      <root>/storage/test.vo</root>
      <filesystem-driver>it.grid.storm.filesystem.swig.posixfs</filesystem-driver>
      <spacesystem-driver>it.grid.storm.filesystem.MockSpaceSystem</spacesystem-driver>
      <storage-area-authz>
        <fixed>permit-all</fixed>
      </storage-area-authz>
      <properties>
        <RetentionPolicy>replica</RetentionPolicy>
        <AccessLatency>online</AccessLatency>
        <ExpirationMode>neverExpire</ExpirationMode>
        <TotalOnlineSize unit="Byte" limited-size="true">4000000000</TotalOnlineSize>
        <TotalNearlineSize unit="Byte">0</TotalNearlineSize>
      </properties>
      <capabilities>
        <aclMode>AoT</aclMode>
        <trans-prot>
          <prot name="file">
            <schema>file</schema>
          </prot>
          <prot name="gsiftp">
            <id>0</id>
            <schema>gsiftp</schema>
            <host>omii005-vm03.cnaf.infn.it</host>
            <port>2811</port>
          </prot>
          <prot name="root">
            <schema>root</schema>
            <host>omii005-vm03.cnaf.infn.it</host>
            <port>1094</port>
          </prot>
          <prot name="xroot">
            <id>1</id>
            <schema>xroot</schema>
            <host>omii005-vm03.cnaf.infn.it</host>
            <port>1094</port>
          </prot>
          <prot name="https">
            <id>2</id>
            <schema>https</schema>
            <host>omii005-vm03.cnaf.infn.it</host>
            <port>8443</port>
          </prot>
          <prot name="http">
            <id>3</id>
            <schema>http</schema>
            <host>omii005-vm03.cnaf.infn.it</host>
            <port>8085</port>
          </prot>
        </trans-prot>
        <pool>
          <balance-strategy>round-robin</balance-strategy>
          <members>
            <member member-id="0">
            </member>
          </members>
        </pool>
      </capabilities>
    </filesystem>
    <filesystem name="TESTVO2-FS" fs_type="ext3">
      <space-token-description>TESTVO2_TOKEN</space-token-description>
      <storage-class>T0D1</storage-class>
      <root>/storage/test.vo.2</root>
      <filesystem-driver>it.grid.storm.filesystem.swig.posixfs</filesystem-driver>
      <spacesystem-driver>it.grid.storm.filesystem.MockSpaceSystem</spacesystem-driver>
      <storage-area-authz>
        <fixed>permit-all</fixed>
      </storage-area-authz>
      <properties>
        <RetentionPolicy>replica</RetentionPolicy>
        <AccessLatency>online</AccessLatency>
        <ExpirationMode>neverExpire</ExpirationMode>
        <TotalOnlineSize unit="Byte" limited-size="true">4000000000</TotalOnlineSize>
        <TotalNearlineSize unit="Byte">0</TotalNearlineSize>
      </properties>
      <capabilities>
        <aclMode>AoT</aclMode>
        <trans-prot>
          <prot name="file">
            <schema>file</schema>
          </prot>
          <prot name="gsiftp">
            <id>0</id>
            <schema>gsiftp</schema>
            <host>omii005-vm03.cnaf.infn.it</host>
            <port>2811</port>
          </prot>
          <prot name="root">
            <schema>root</schema>
            <host>omii005-vm03.cnaf.infn.it</host>
            <port>1094</port>
          </prot>
          <prot name="xroot">
            <id>1</id>
            <schema>xroot</schema>
            <host>omii005-vm03.cnaf.infn.it</host>
            <port>1094</port>
          </prot>
          <prot name="https">
            <id>2</id>
            <schema>https</schema>
            <host>omii005-vm03.cnaf.infn.it</host>
            <port>8443</port>
          </prot>
          <prot name="http">
            <id>3</id>
            <schema>http</schema>
            <host>omii005-vm03.cnaf.infn.it</host>
            <port>8085</port>
          </prot>
        </trans-prot>
        <pool>
          <balance-strategy>round-robin</balance-strategy>
          <members>
            <member member-id="0">
            </member>
          </members>
        </pool>
      </capabilities>
    </filesystem>
    <filesystem name="IGI-FS" fs_type="ext3">
      <space-token-description>IGI_TOKEN</space-token-description>
      <storage-class>T0D1</storage-class>
      <root>/storage/igi</root>
      <filesystem-driver>it.grid.storm.filesystem.swig.posixfs</filesystem-driver>
      <spacesystem-driver>it.grid.storm.filesystem.MockSpaceSystem</spacesystem-driver>
      <storage-area-authz>
        <fixed>permit-all</fixed>
      </storage-area-authz>
      <properties>
        <RetentionPolicy>replica</RetentionPolicy>
        <AccessLatency>online</AccessLatency>
        <ExpirationMode>neverExpire</ExpirationMode>
        <TotalOnlineSize unit="Byte" limited-size="true">4000000000</TotalOnlineSize>
        <TotalNearlineSize unit="Byte">0</TotalNearlineSize>
      </properties>
      <capabilities>
        <aclMode>AoT</aclMode>
        <trans-prot>
          <prot name="file">
            <schema>file</schema>
          </prot>
          <prot name="gsiftp">
            <id>0</id>
            <schema>gsiftp</schema>
            <host>omii005-vm03.cnaf.infn.it</host>
            <port>2811</port>
          </prot>
          <prot name="root">
            <schema>root</schema>
            <host>omii005-vm03.cnaf.infn.it</host>
            <port>1094</port>
          </prot>
          <prot name="xroot">
            <id>1</id>
            <schema>xroot</schema>
            <host>omii005-vm03.cnaf.infn.it</host>
            <port>1094</port>
          </prot>
          <prot name="https">
            <id>2</id>
            <schema>https</schema>
            <host>omii005-vm03.cnaf.infn.it</host>
            <port>8443</port>
          </prot>
          <prot name="http">
            <id>3</id>
            <schema>http</schema>
            <host>omii005-vm03.cnaf.infn.it</host>
            <port>8085</port>
          </prot>
        </trans-prot>
        <pool>
          <balance-strategy>round-robin</balance-strategy>
          <members>
            <member member-id="0">
            </member>
          </members>
        </pool>
      </capabilities>
    </filesystem>
    <filesystem name="NOAUTH-FS" fs_type="ext3">
      <space-token-description>NOAUTH_TOKEN</space-token-description>
      <storage-class>T0D1</storage-class>
      <root>/storage/noauth</root>
      <filesystem-driver>it.grid.storm.filesystem.swig.posixfs</filesystem-driver>
      <spacesystem-driver>it.grid.storm.filesystem.MockSpaceSystem</spacesystem-driver>
      <storage-area-authz>
        <fixed>permit-all</fixed>
      </storage-area-authz>
      <properties>
        <RetentionPolicy>replica</RetentionPolicy>
        <AccessLatency>online</AccessLatency>
        <ExpirationMode>neverExpire</ExpirationMode>
        <TotalOnlineSize unit="Byte" limited-size="true">4000000000</TotalOnlineSize>
        <TotalNearlineSize unit="Byte">0</TotalNearlineSize>
      </properties>
      <capabilities>
        <aclMode>AoT</aclMode>
        <trans-prot>
          <prot name="file">
            <schema>file</schema>
          </prot>
          <prot name="gsiftp">
            <id>0</id>
            <schema>gsiftp</schema>
            <host>omii005-vm03.cnaf.infn.it</host>
            <port>2811</port>
          </prot>
          <prot name="root">
            <schema>root</schema>
            <host>omii005-vm03.cnaf.infn.it</host>
            <port>1094</port>
          </prot>
          <prot name="xroot">
            <id>1</id>
            <schema>xroot</schema>
            <host>omii005-vm03.cnaf.infn.it</host>
            <port>1094</port>
          </prot>
          <prot name="https">
            <id>2</id>
            <schema>https</schema>
            <host>omii005-vm03.cnaf.infn.it</host>
            <port>8443</port>
          </prot>
          <prot name="http">
            <id>3</id>
            <schema>http</schema>
            <host>omii005-vm03.cnaf.infn.it</host>
            <port>8085</port>
          </prot>
        </trans-prot>
        <pool>
          <balance-strategy>round-robin</balance-strategy>
          <members>
            <member member-id="0">
            </member>
          </members>
        </pool>
      </capabilities>
    </filesystem>
    <filesystem name="TESTVOBIS-FS" fs_type="ext3">
      <space-token-description>TESTVOBIS_TOKEN</space-token-description>
      <storage-class>T0D1</storage-class>
      <root>/storage/test.vo.bis</root>
      <filesystem-driver>it.grid.storm.filesystem.swig.posixfs</filesystem-driver>
      <spacesystem-driver>it.grid.storm.filesystem.MockSpaceSystem</spacesystem-driver>
      <storage-area-authz>
        <fixed>permit-all</fixed>
      </storage-area-authz>
      <properties>
        <RetentionPolicy>replica</RetentionPolicy>
        <AccessLatency>online</AccessLatency>
        <ExpirationMode>neverExpire</ExpirationMode>
        <TotalOnlineSize unit="Byte" limited-size="true">4000000000</TotalOnlineSize>
        <TotalNearlineSize unit="Byte">0</TotalNearlineSize>
      </properties>
      <capabilities>
        <aclMode>AoT</aclMode>
        <trans-prot>
          <prot name="file">
            <schema>file</schema>
          </prot>
          <prot name="gsiftp">
            <id>0</id>
            <schema>gsiftp</schema>
            <host>omii005-vm03.cnaf.infn.it</host>
            <port>2811</port>
          </prot>
          <prot name="root">
            <schema>root</schema>
            <host>omii005-vm03.cnaf.infn.it</host>
            <port>1094</port>
          </prot>
          <prot name="xroot">
            <id>1</id>
            <schema>xroot</schema>